{
  "id": "escalation.emergency_request_during_an_intention_starts_the_wait",
  "kind": "escalation",
  "description": "The user is never trapped: an emergency request is accepted while an intention runs (a budget may block mid-intention). The intention ends, the 120 s wait starts and the override is recorded as a bypass.",
  "given": {
    "state": {
      "targetGroup": "r-reddit-friction",
      "phase": "idle",
      "attemptCount": 0,
      "lastAttemptAt": null,
      "lastActivityAt": null,
      "brokenCount": 0,
      "lastFrictionType": null,
      "gate": null,
      "pauseEndsAt": null,
      "pendingExtension": false,
      "intentionExpiresAt": null,
      "overrideReadyAt": null,
      "overrideEndsAt": null
    },
    "guardianLinked": false
  },
  "steps": [
    {
      "at": "2026-10-26T10:00:00+11:00",
      "event": {
        "type": "visit"
      },
      "then": {
        "state": {
          "targetGroup": "r-reddit-friction",
          "phase": "pausing",
          "attemptCount": 1,
          "lastAttemptAt": "2026-10-25T23:00:00Z",
          "lastActivityAt": "2026-10-25T23:00:00Z",
          "brokenCount": 0,
          "lastFrictionType": "countdown",
          "gate": {
            "level": 0,
            "pauseSeconds": 5,
            "frictionType": "countdown",
            "requiresTypedIntention": false,
            "requiresGuardianKey": false
          },
          "pauseEndsAt": "2026-10-25T23:00:05Z",
          "pendingExtension": false,
          "intentionExpiresAt": null,
          "overrideReadyAt": null,
          "overrideEndsAt": null
        },
        "effects": []
      }
    },
    {
      "at": "2026-10-26T10:00:05+11:00",
      "event": {
        "type": "pause_elapsed"
      },
      "then": {
        "state": {
          "targetGroup": "r-reddit-friction",
          "phase": "asking",
          "attemptCount": 1,
          "lastAttemptAt": "2026-10-25T23:00:00Z",
          "lastActivityAt": "2026-10-25T23:00:05Z",
          "brokenCount": 0,
          "lastFrictionType": "countdown",
          "gate": {
            "level": 0,
            "pauseSeconds": 5,
            "frictionType": "countdown",
            "requiresTypedIntention": false,
            "requiresGuardianKey": false
          },
          "pauseEndsAt": "2026-10-25T23:00:05Z",
          "pendingExtension": false,
          "intentionExpiresAt": null,
          "overrideReadyAt": null,
          "overrideEndsAt": null
        },
        "effects": []
      }
    },
    {
      "at": "2026-10-26T10:00:10+11:00",
      "event": {
        "type": "commit",
        "minutes": 15,
        "typedWords": 0,
        "guardianKeyVerified": false
      },
      "then": {
        "state": {
          "targetGroup": "r-reddit-friction",
          "phase": "active",
          "attemptCount": 1,
          "lastAttemptAt": "2026-10-25T23:00:00Z",
          "lastActivityAt": "2026-10-25T23:00:10Z",
          "brokenCount": 0,
          "lastFrictionType": "countdown",
          "gate": null,
          "pauseEndsAt": null,
          "pendingExtension": false,
          "intentionExpiresAt": "2026-10-25T23:15:10Z",
          "overrideReadyAt": null,
          "overrideEndsAt": null
        },
        "effects": []
      }
    },
    {
      "at": "2026-10-26T10:05:00+11:00",
      "event": {
        "type": "emergency_request"
      },
      "then": {
        "state": {
          "targetGroup": "r-reddit-friction",
          "phase": "override_waiting",
          "attemptCount": 1,
          "lastAttemptAt": "2026-10-25T23:00:00Z",
          "lastActivityAt": "2026-10-25T23:05:00Z",
          "brokenCount": 0,
          "lastFrictionType": "countdown",
          "gate": null,
          "pauseEndsAt": null,
          "pendingExtension": false,
          "intentionExpiresAt": null,
          "overrideReadyAt": "2026-10-25T23:07:00Z",
          "overrideEndsAt": null
        },
        "effects": []
      }
    },
    {
      "at": "2026-10-26T10:07:00+11:00",
      "event": {
        "type": "emergency_wait_elapsed"
      },
      "then": {
        "state": {
          "targetGroup": "r-reddit-friction",
          "phase": "override_active",
          "attemptCount": 1,
          "lastAttemptAt": "2026-10-25T23:00:00Z",
          "lastActivityAt": "2026-10-25T23:07:00Z",
          "brokenCount": 0,
          "lastFrictionType": "countdown",
          "gate": null,
          "pauseEndsAt": null,
          "pendingExtension": false,
          "intentionExpiresAt": null,
          "overrideReadyAt": "2026-10-25T23:07:00Z",
          "overrideEndsAt": "2026-10-25T23:22:00Z"
        },
        "effects": ["record_bypass"]
      }
    }
  ]
}
