{
  "id": "escalation.l3_without_guardian_falls_back_to_60s_typed",
  "kind": "escalation",
  "description": "Without a guardian the fourth gate pauses 60 s and asks for a typed intention instead of a guardian key.",
  "given": {
    "state": {
      "targetGroup": "r-x-friction",
      "phase": "idle",
      "attemptCount": 3,
      "lastAttemptAt": "2026-10-25T22:50:00Z",
      "lastActivityAt": "2026-10-25T22:50:00Z",
      "brokenCount": 0,
      "lastFrictionType": "reflect",
      "gate": null,
      "pauseEndsAt": null,
      "pendingExtension": false,
      "intentionExpiresAt": null,
      "overrideReadyAt": null,
      "overrideEndsAt": null
    },
    "guardianLinked": false
  },
  "steps": [
    {
      "at": "2026-10-26T10:00:00+11:00",
      "event": {
        "type": "visit"
      },
      "then": {
        "state": {
          "targetGroup": "r-x-friction",
          "phase": "pausing",
          "attemptCount": 4,
          "lastAttemptAt": "2026-10-25T23:00:00Z",
          "lastActivityAt": "2026-10-25T23:00:00Z",
          "brokenCount": 0,
          "lastFrictionType": "type-intention",
          "gate": {
            "level": 3,
            "pauseSeconds": 60,
            "frictionType": "type-intention",
            "requiresTypedIntention": true,
            "requiresGuardianKey": false
          },
          "pauseEndsAt": "2026-10-25T23:01:00Z",
          "pendingExtension": false,
          "intentionExpiresAt": null,
          "overrideReadyAt": null,
          "overrideEndsAt": null
        },
        "effects": []
      }
    },
    {
      "at": "2026-10-26T10:00:59+11:00",
      "event": {
        "type": "pause_elapsed"
      },
      "then": {
        "state": {
          "targetGroup": "r-x-friction",
          "phase": "pausing",
          "attemptCount": 4,
          "lastAttemptAt": "2026-10-25T23:00:00Z",
          "lastActivityAt": "2026-10-25T23:00:00Z",
          "brokenCount": 0,
          "lastFrictionType": "type-intention",
          "gate": {
            "level": 3,
            "pauseSeconds": 60,
            "frictionType": "type-intention",
            "requiresTypedIntention": true,
            "requiresGuardianKey": false
          },
          "pauseEndsAt": "2026-10-25T23:01:00Z",
          "pendingExtension": false,
          "intentionExpiresAt": null,
          "overrideReadyAt": null,
          "overrideEndsAt": null
        },
        "effects": []
      }
    },
    {
      "at": "2026-10-26T10:01:00+11:00",
      "event": {
        "type": "pause_elapsed"
      },
      "then": {
        "state": {
          "targetGroup": "r-x-friction",
          "phase": "asking",
          "attemptCount": 4,
          "lastAttemptAt": "2026-10-25T23:00:00Z",
          "lastActivityAt": "2026-10-25T23:01:00Z",
          "brokenCount": 0,
          "lastFrictionType": "type-intention",
          "gate": {
            "level": 3,
            "pauseSeconds": 60,
            "frictionType": "type-intention",
            "requiresTypedIntention": true,
            "requiresGuardianKey": false
          },
          "pauseEndsAt": "2026-10-25T23:01:00Z",
          "pendingExtension": false,
          "intentionExpiresAt": null,
          "overrideReadyAt": null,
          "overrideEndsAt": null
        },
        "effects": []
      }
    },
    {
      "at": "2026-10-26T10:01:10+11:00",
      "event": {
        "type": "commit",
        "minutes": 5,
        "typedWords": 4,
        "guardianKeyVerified": false
      },
      "then": {
        "state": {
          "targetGroup": "r-x-friction",
          "phase": "active",
          "attemptCount": 4,
          "lastAttemptAt": "2026-10-25T23:00:00Z",
          "lastActivityAt": "2026-10-25T23:01:10Z",
          "brokenCount": 0,
          "lastFrictionType": "type-intention",
          "gate": null,
          "pauseEndsAt": null,
          "pendingExtension": false,
          "intentionExpiresAt": "2026-10-25T23:06:10Z",
          "overrideReadyAt": null,
          "overrideEndsAt": null
        },
        "effects": []
      }
    }
  ]
}
